Date,Impressions,From Home,From Hashtags,From Explore,From Other,Saves,Comments,Shares,Likes,Profile Visits,Follows,Conversion Rate,Caption,Hashtags
1/26/2022,2826,2108,583,76,34,67,3,3,114,30,4,13.33333333,Visualizing data is one of the most valuable skills every Data Scientist and Analyst should have. There are a lot of data visualizations to learn in data science. Here you will find a list of all data visualizations for data science explained using Python.,#dataanalytics #datascience #data #machinelearning #datavisualization #bigdata #artificialintelligence #datascientist #python #analytics #ai #dataanalysis #deeplearning #technology #programming #coding #dataanalyst #business #pythonprogramming #datamining #tech #businessintelligence #database #computerscience #statistics #powerbi #dataanalysisprojects #businessanalytics #thecleverprogrammer #amankharwal
1/27/2022,7407,2782,1938,2237,226,288,5,15,263,39,18,46.15384615,Here are some of the most important machine learning algorithms that every beginner in machine learning should know.,#data #datascience #dataanalysis #dataanalytics #datascientist #machinelearning #python #pythonprogramming #pythonprojects #pythoncode #artificialintelligence #ai #deeplearning #machinelearningprojects #datascienceprojects #amankharwal #thecleverprogrammer
1/28/2022,10386,4137,3551,2355,205,668,8,41,328,42,38,90.47619048,Here are some of the best websites that you can follow to learn everything in data science.,#data #datascience #dataanalysis #dataanalytics #datascientist #machinelearning #python #pythonprogramming #pythonprojects #pythoncode #artificialintelligence #ai #deeplearning #machinelearningprojects #datascienceprojects #amankharwal #thecleverprogrammer
1/29/2022,2998,1945,794,84,139,42,4,1,126,31,10,32.25806452,Time series analysis means analyzing and finding patterns in a time series dataset. A time-series dataset is a sequence of data collected over an interval of time. Here you will learn how to do Time Series Analysis using Python.,#timeseries #time #statistics #datascience #bigdata #machinelearning #python #ai #timeseriesanalysis #datavisualization #dataanalytics #data #iot #analysis #timeseriesmalaysia #artificialintelligence #analytics #amankharwal #thecleverprogrammer
1/30/2022,7018,2569,4221,796,83,342,9,16,236,20,12,60,Here are some of the best data sources that you can use to collect data for your data science projects.,#data #datascience #dataanalysis #dataanalytics #datascientist #machinelearning #python #pythonprogramming #pythonprojects #pythoncode #artificialintelligence #ai #deeplearning #machinelearningprojects #datascienceprojects #amankharwal #thecleverprogrammer
1/31/2022,2941,1716,1058,84,48,48,2,1,99,12,4,33.33333333,"One of the mistakes data science newbies make while working on a machine learning project is that they train a machine learning model, check its accuracy score, and then complete the project. They do not test the performance of the model by giving inputs to the model based on the features they used to train it. Here you will learn how to give inputs to a machine learning model to test its performance.",#data #datascience #dataanalysis #dataanalytics #datascientist #machinelearning #python #pythonprogramming #pythonprojects #pythoncode #artificialintelligence #ai #deeplearning #machinelearningprojects #datascienceprojects #amankharwal #thecleverprogrammer
2/1/2022,6432,2812,2974,468,72,250,11,8,212,22,4,18.18181818,Here are some of the best data science project ideas for resume that you should try in 2022.,#data #datascience #dataanalysis #dataanalytics #datascientist #machinelearning #python #pythonprogramming #pythonprojects #pythoncode #artificialintelligence #ai #deeplearning #machinelearningprojects #datascienceprojects #amankharwal #thecleverprogrammer
2/2/2022,10667,3152,6564,617,187,219,13,15,297,306,74,24.18300654,170 Python Projects with Source Code solved and explained for free: Link in Bio,#python #pythonprogramming #pythonprojects #pythoncode #pythonlearning #pythondeveloper #pythoncoding #pythonprogrammer #amankharwal #thecleverprogrammer #pythonprojects
2/3/2022,3988,2415,802,545,64,118,6,9,142,13,0,0,Here are some of the most important data visualizations that every data scientist must know.,#datavisualization #datascience #data #dataanalytics #machinelearning #dataanalysis #artificialintelligence #python #datascientist #bigdata #deeplearning #dataviz #ai #analytics #technology #dataanalyst #programming #pythonprogramming #statistics #coding #businessintelligence #datamining #tech #business #computerscience #tableau #database #bigdataanalytics #powerbi
2/4/2022,4978,2125,2249,354,99,143,9,2,186,26,6,23.07692308,Here are some of the best data science projects ideas based on recommendation systems that you should try.,#recommended #recommendations #recommendationsystem #recommendation #data #datascience #dataanalysis #dataanalytics #datascientist #machinelearning #python #pythonprogramming #pythonprojects #pythoncode #artificialintelligence #ai #amankharwal #thecleverprogrammer
2/5/2022,3388,1975,1018,244,44,99,1,7,112,16,6,37.5,"Variance, covariance, and correlation are statistical measures for finding the relationship between data points in a dataset. Here’s the difference between variance, covariance, and correlation that you should know.",#datavisualization #datascience #data #dataanalytics #machinelearning #dataanalysis #artificialintelligence #python #datascientist #bigdata #deeplearning #dataviz #ai #analytics #technology #dataanalyst #programming #pythonprogramming #statistics #amankharwal #thecleverprogrammer
2/6/2022,4467,1910,1880,492,60,89,3,16,149,15,0,0,Here are some of the popular applications of data science in finance.,#data #datascience #dataanalysis #dataanalytics #datascientist #machinelearning #python #pythonprogramming #pythonprojects #pythoncode #artificialintelligence #ai #deeplearning #machinelearningprojects #datascienceprojects #amankharwal #thecleverprogrammer #finance #business #money #investing
2/7/2022,3246,2508,166,360,139,148,5,14,132,15,6,40,Here are some of the best websites to prepare for coding interviews.,#coding #programming #programmer #python #developer #javascript #code #coder #technology #html #computerscience #codinglife #java #webdeveloper #tech #css #webdevelopment #software #softwaredeveloper #interview #job #codinginterview #amankharwal #thecleverprogrammer
2/8/2022,5072,1780,3090,69,76,42,7,6,115,39,12,30.76923077,"The introduction of online payment systems has helped a lot in the ease of payments. But, at the same time, it increased in payment frauds. Here you will learn how to detect online payment frauds with machine learning using Python.",#data #datascience #dataanalysis #dataanalytics #datascientist #machinelearning #python #pythonprogramming #pythonprojects #pythoncode #artificialintelligence #ai #deeplearning #machinelearningprojects #datascienceprojects #amankharwal #thecleverprogrammer
2/9/2022,6339,2190,4036,48,27,171,8,5,248,21,10,47.61904762,Here are some of the best data science project ideas on healthcare. If you want to become a data science professional in the healthcare domain then you must try to work on these projects.,#healthcare #health #covid #data #datascience #dataanalysis #dataanalytics #datascientist #machinelearning #python #pythonprogramming #pythonprojects #pythoncode #artificialintelligence #ai #dataanalyst #amankharwal #thecleverprogrammer
2/10/2022,4239,1711,2429,36,50,109,2,1,178,8,8,100,Here are some of the most important tools that I use daily as a Data Scientist/Analyst.,#data #datascience #dataanalysis #dataanalytics #datascientist #machinelearning #python #pythonprogramming #pythonprojects #pythoncode #artificialintelligence #ai #deeplearning #machinelearningprojects #datascienceprojects #amankharwal #thecleverprogrammer
2/11/2022,3454,1663,1284,166,234,38,0,0,107,45,8,17.77777778,Here you will learn how to visualize the linear regression algorithm in machine learning using Python. Find this complete tutorial from the link in bio😀,#data #datascience #dataanalysis #dataanalytics #datascientist #machinelearning #python #pythonprogramming #pythonprojects #pythoncode #artificialintelligence #ai #deeplearning #algorithm #algorithms #machinelearningalgorithms #amankharwal #thecleverprogrammer
2/12/2022,7571,3717,841,1716,1115,421,7,12,269,50,46,92,Here are some of the very useful Python scripts that you can use to solve real-time problems in your projects.,#python #pythonprogramming #pythonprojects #pythoncode #pythonlearning #pythondeveloper #pythoncoding #pythonprogrammer #amankharwal #thecleverprogrammer
2/13/2022,3333,1502,1423,182,148,38,3,5,96,37,12,32.43243243,"If you want to know how to predict the future prices of any cryptocurrency with machine learning, this will help you. Here you will learn how to predict the future prices of bitcoin with machine learning using Python.",#data #datascience #dataanalysis #dataanalytics #datascientist #machinelearning #python #pythonprogramming #pythonprojects #pythoncode #artificialintelligence #ai #deeplearning #machinelearningprojects #datascienceprojects #amankharwal #thecleverprogrammer #bitcoin #cryptocurrency
2/14/2022,3818,2357,442,250,536,116,6,0,134,25,10,40,"To calculate the execution time of the program, we need to calculate the time taken by the program from its initiation to the final result. Here’s how to calculate the execution time of a Python program.",#python #pythonprogramming #pythonprojects #pythoncode #pythonlearning #pythondeveloper #pythoncoding #pythonprogrammer #amankharwal #thecleverprogrammer
2/15/2022,10933,3152,6610,623,334,225,13,15,301,347,94,27.08933718,170 Python Projects with Source Code solved and explained for free: Link in Bio,#python #pythonprogramming #pythonprojects #pythoncode #pythonlearning #pythondeveloper #pythoncoding #pythonprogrammer #amankharwal #thecleverprogrammer #pythonprojects
2/16/2022,5058,2125,2250,362,111,144,9,2,187,26,6,23.07692308,Here are some of the best data science projects ideas based on recommendation systems that you should try.,#recommended #recommendations #recommendationsystem #recommendation #data #datascience #dataanalysis #dataanalytics #datascientist #machinelearning #python #pythonprogramming #pythonprojects #pythoncode #artificialintelligence #ai #amankharwal #thecleverprogrammer
2/17/2022,3601,1570,1518,174,167,51,0,3,94,48,10,20.83333333,One of the most popular use cases of data science is the task of sentiment analysis of product reviews sold on e-commerce platforms. Here you will learn how to analyze the sentiments of Flipkart reviews using Python.,#data #datascience #dataanalysis #dataanalytics #datascientist #machinelearning #python #pythonprogramming #pythonprojects #pythoncode #artificialintelligence #ai #deeplearning #sentimentanalysis #sentiment #nlp #naturallanguageprocessing #amankharwal #thecleverprogrammer #flipkart
2/18/2022,3480,1975,1019,245,72,104,1,7,114,16,6,37.5,"Variance, covariance, and correlation are statistical measures for finding the relationship between data points in a dataset. Here’s the difference between variance, covariance, and correlation that you should know.",#datavisualization #datascience #data #dataanalytics #machinelearning #dataanalysis #artificialintelligence #python #datascientist #bigdata #deeplearning #dataviz #ai #analytics #technology #dataanalyst #programming #pythonprogramming #statistics #amankharwal #thecleverprogrammer
2/19/2022,3525,1323,1699,182,292,33,5,0,96,26,4,15.38461538,You must have seen the news divided into categories when you go to a news website. Here you will learn how to classify news articles with machine learning using Python.,#data #datascience #dataanalysis #dataanalytics #datascientist #machinelearning #python #pythonprogramming #pythonprojects #pythoncode #artificialintelligence #ai #deeplearning #machinelearningprojects #datascienceprojects #amankharwal #thecleverprogrammer #news
2/20/2022,3606,2509,183,446,300,174,5,15,138,17,12,70.58823529,Here are some of the best websites to prepare for coding interviews.,#coding #programming #programmer #python #developer #javascript #code #coder #technology #html #computerscience #codinglife #java #webdeveloper #tech #css #webdevelopment #software #softwaredeveloper #interview #job #codinginterview #amankharwal #thecleverprogrammer
2/21/2022,5542,1782,3212,213,168,46,7,6,122,52,16,30.76923077,"The introduction of online payment systems has helped a lot in the ease of payments. But, at the same time, it increased in payment frauds. Here you will learn how to detect online payment frauds with machine learning using Python.",#data #datascience #dataanalysis #dataanalytics #datascientist #machinelearning #python #pythonprogramming #pythonprojects #pythoncode #artificialintelligence #ai #deeplearning #machinelearningprojects #datascienceprojects #amankharwal #thecleverprogrammer
2/22/2022,6559,2225,4041,158,72,179,8,6,257,22,12,54.54545455,Here are some of the best data science project ideas on healthcare. If you want to become a data science professional in the healthcare domain then you must try to work on these projects.,#healthcare #health #covid #data #datascience #dataanalysis #dataanalytics #datascientist #machinelearning #python #pythonprogramming #pythonprojects #pythoncode #artificialintelligence #ai #dataanalyst #amankharwal #thecleverprogrammer
2/23/2022,3623,1179,1527,157,655,34,3,0,95,41,8,19.51219512,Learn how to create an interactive language translator using Python: Link in Bio,#python #pythonprogramming #pythonprojects #pythoncode #pythonlearning #pythondeveloper #pythoncoding #pythonprogrammer #amankharwal #thecleverprogrammer #naturallanguageprocessing #nlp
2/24/2022,10493,2106,7761,248,238,99,9,1,244,155,32,20.64516129,Here is a list of 100+ Machine Learning Algorithms and Models explained using Python that will help you to understand the implementation of all the machine learning algorithms and models in solving real-time business problems. You can find this list of 100+ Machine Learning Algorithms and Models from the link in bio.,#data #datascience #dataanalysis #dataanalytics #datascientist #machinelearning #python #pythonprogramming #pythonprojects #pythoncode #artificialintelligence #ai #deeplearning #algorithm #algorithms #machinelearningalgorithms #amankharwal #thecleverprogrammer
2/25/2022,4446,2454,1590,192,69,174,6,11,190,12,8,66.66666667,Here are some of the best YouTube channels that you can follow to learn data science.,#data #datascience #dataanalysis #dataanalytics #datascientist #machinelearning #python #pythonprogramming #pythonprojects #pythoncode #artificialintelligence #ai #deeplearning #machinelearningprojects #datascienceprojects #amankharwal #thecleverprogrammer
2/26/2022,2957,1926,349,217,369,70,4,2,118,22,16,72.72727273,Python program to count the number of capital letters from a file.,#python #pythonprogramming #pythonprojects #pythoncode #pythonlearning #pythondeveloper #pythoncoding #pythonprogrammer #amankharwal #thecleverprogrammer #pythonprogram @codergallery
2/27/2022,5538,2597,2376,412,63,149,6,6,178,20,6,30,"Follow these steps to collect your WhatsApp chat data for a data science project. You can use your WhatsApp chat data for Text Analysis, Sentiment Analysis, and many more tasks based on Natural Language Processing.",#data #datascience #dataanalysis #dataanalytics #datascientist #machinelearning #python #pythonprogramming #pythonprojects #pythoncode #artificialintelligence #ai #deeplearning #machinelearningprojects #datascienceprojects #amankharwal #thecleverprogrammer #whatsapp
2/28/2022,4681,2252,1674,360,308,207,7,12,170,23,10,43.47826087,Here are some of the best resources on the internet to learn machine learning for free.,#data #datascience #dataanalysis #dataanalytics #datascientist #machinelearning #python #pythonprogramming #pythonprojects #pythoncode #artificialintelligence #ai #deeplearning #machinelearningprojects #datascienceprojects #amankharwal #thecleverprogrammer
3/1/2022,5273,2673,2003,433,114,318,9,22,250,25,10,40,"Here is a complete roadmap to data science that you can follow to learn data science from scratch. All the resources to learn from are also mentioned here. Swipe>>, Save, and Share.",#data #datascience #dataanalysis #dataanalytics #datascientist #machinelearning #python #pythonprogramming #pythonprojects #pythoncode #artificialintelligence #ai #deeplearning #machinelearningprojects #datascienceprojects #amankharwal #thecleverprogrammer #roadmap
3/2/2022,5055,2017,2351,298,108,101,7,11,159,17,6,35.29411765,"In Data Science, Time Series Analysis is a method of analyzing data collected over an interval of time. Stock price data and covid-19 cases data are examples of time-series data. Time Series Analysis helps understand the underlying causes of trends and patterns at particular time intervals. So it is one of the topics that every data scientist should know perfectly. So if you are looking for some of the best books to learn Time Series Analysis, you can choose any one among these books.",#timeseries #time #statistics #datascience #bigdata #machinelearning #python #ai #timeseriesanalysis #datavisualization #dataanalytics #data #iot #analysis #timeseriesmalaysia #artificialintelligence #analytics #amankharwal #thecleverprogrammer
3/3/2022,4002,3401,278,128,73,111,17,18,205,16,2,12.5,"Here are some of the highest paying skills in 2022 that you should start learning today. These skills do not require you to come from a specific education background. If you are passionate about learning any of these skills, then you can easily find so many free resources on the internet. If you don’t know how to find free resources to learn these skills, feel free to reach me @aman.kharwal, I will be happy to guide you.",#career #job #jobs #jobsearch #education #business #success #careergoals #motivation #work #careerdevelopment #careers #goals #resume #students #careeradvice #datascience #marketing #digitalmarketing #media #socialmedia #IT #webdevelopment #amankharwal #thecleverprogrammer
3/4/2022,3169,1979,707,341,32,106,8,1,121,21,2,9.523809524,"In Data Science, Time Series Analysis is a method of analyzing data collected over an interval of time. Stock price data and covid-19 cases data are examples of time-series data. Time Series Analysis helps understand the underlying causes of trends and patterns at particular time intervals. So it is one of the topics that every data scientist should know perfectly. So if you are looking for some of the best data science project ideas on Time Series Analysis, you should try to work on these projects.",#timeseries #time #statistics #datascience #bigdata #machinelearning #python #ai #timeseriesanalysis #datavisualization #dataanalytics #data #iot #analysis #timeseriesmalaysia #artificialintelligence #analytics #amankharwal #thecleverprogrammer
3/5/2022,6168,2177,3450,153,296,82,6,6,151,77,30,38.96103896,"Stress, anxiety, and depression are threatening the mental health of people. Every person has a reason for having a stressful life. People often share their feelings on social media platforms like on Instagram in the form of posts and stories, and on Reddit in the form of asking for suggestions about their life on subreddits. In the past few years, many content creators have come forward to create content to help people with their mental health. Many organizations can use stress detection to find which social media users are stressed to help them quickly. So if you want to learn how to use machine learning to detect stress on social media posts, this data science project is for you. Detection of stress from social media posts with machine learning using Python: Link in Bio.",#data #datascience #dataanalysis #dataanalytics #datascientist #machinelearning #python #pythonprogramming #pythonprojects #pythoncode #artificialintelligence #ai #deeplearning #machinelearningprojects #datascienceprojects #amankharwal #thecleverprogrammer #machinelearningmodels #stress #stressdetection
3/6/2022,2407,1338,655,276,39,40,8,20,72,10,0,0,Data Science Use Cases: Here’s how Zomato is using your data for its future business model.,#data #datascience #dataanalysis #dataanalytics #datascientist #machinelearning #python #pythonprogramming #pythonprojects #pythoncode #artificialintelligence #ai #deeplearning #machinelearningprojects #datascienceprojects #amankharwal #thecleverprogrammer #machinelearningmodels #zomato #business #casestudy #businessmodel
3/7/2022,3630,1747,1693,72,86,137,4,10,137,14,4,28.57142857,Here are some of the best data analysis project ideas for resume that you should try.,#data #datascience #dataanalysis #dataanalytics #datascientist #machinelearning #python #pythonprogramming #pythonprojects #pythoncode #artificialintelligence #ai #deeplearning #machinelearningprojects #datascienceprojects #amankharwal #thecleverprogrammer
3/8/2022,2826,2108,583,76,34,67,3,3,114,30,4,13.33333333,Visualizing data is one of the most valuable skills every Data Scientist and Analyst should have. There are a lot of data visualizations to learn in data science. Here you will find a list of all data visualizations for data science explained using Python.,#dataanalytics #datascience #data #machinelearning #datavisualization #bigdata #artificialintelligence #datascientist #python #analytics #ai #dataanalysis #deeplearning #technology #programming #coding #dataanalyst #business #pythonprogramming #datamining #tech #businessintelligence #database #computerscience #statistics #powerbi #dataanalysisprojects #businessanalytics #thecleverprogrammer #amankharwal
3/9/2022,7407,2782,1938,2237,226,288,5,15,263,39,18,46.15384615,Here are some of the most important machine learning algorithms that every beginner in machine learning should know.,#data #datascience #dataanalysis #dataanalytics #datascientist #machinelearning #python #pythonprogramming #pythonprojects #pythoncode #artificialintelligence #ai #deeplearning #machinelearningprojects #datascienceprojects #amankharwal #thecleverprogrammer
3/10/2022,10386,4137,3551,2355,205,668,8,41,328,42,38,90.47619048,Here are some of the best websites that you can follow to learn everything in data science.,#data #datascience #dataanalysis #dataanalytics #datascientist #machinelearning #python #pythonprogramming #pythonprojects #pythoncode #artificialintelligence #ai #deeplearning #machinelearningprojects #datascienceprojects #amankharwal #thecleverprogrammer
3/11/2022,2998,1945,794,84,139,42,4,1,126,31,10,32.25806452,Time series analysis means analyzing and finding patterns in a time series dataset. A time-series dataset is a sequence of data collected over an interval of time. Here you will learn how to do Time Series Analysis using Python.,#timeseries #time #statistics #datascience #bigdata #machinelearning #python #ai #timeseriesanalysis #datavisualization #dataanalytics #data #iot #analysis #timeseriesmalaysia #artificialintelligence #analytics #amankharwal #thecleverprogrammer
3/12/2022,3052,2608,201,121,87,63,5,14,129,14,2,14.28571429,Here are all the programming languages that Google uses in the Front-end and the back-end of Google.,#programming #coding #programmer #python #developer #javascript #technology #code #coder #java #html #computerscience #tech #css #webdeveloper #software #webdevelopment #codinglife #softwaredeveloper #linux #programmingmemes #webdesign #programmers #php #programminglife #machinelearning #hacking #pythonprogramming #thecleverprogrammer #amankharwal
3/13/2022,4628,2406,1260,861,26,144,8,3,160,10,4,40,"Deep Learning is a subset of machine learning. If you want to become a machine learning engineer, you should know everything about deep learning. If you are looking for some of the best free resources to learn deep learning then here are the two best free resources to learn deep learning.",#deeplearning #machinelearning #artificialintelligence #datascience #ai #python #coding #technology #programming #bigdata #dataanalytics #datascientist #data #computerscience #tech #neuralnetwork #amankharwal #thecleverprogrammer
3/14/2022,4082,2195,1248,541,36,135,11,5,175,19,6,31.57894737,Deep learning is a subset of machine learning in which we use artificial neural networks to train models to solve complex problems where we need a large amount of data compared to other machine learning algorithms. Here are some of the best deep learning project ideas that you must try.,#deeplearning #machinelearning #artificialintelligence #datascience #ai #python #coding #technology #programming #bigdata #dataanalytics #datascientist #data #computerscience #tech #neuralnetwork #amankharwal #thecleverprogrammer
