Date,Impressions,From Home,From Hashtags,From Explore,From Other,Saves,Comments,Shares,Likes,Profile Visits,Follows,Conversion Rate,Caption,Hashtags
5/3/2022,30637,8860,2495,18003,510,1006,23,81,631,134,110,82.08955224,Here are some of the most important skills you need for your first data science job.,#datascience #datasciencejobs #datasciencetraining #datascienceeducation #datasciencecourse #data #dataanalysis #dataanalytics #datascientist #machinelearning #artificialintelligence #ai #deeplearning #machinelearningprojects #datascienceprojects #amankharwal #thecleverprogrammer
5/4/2022,26601,6062,1382,18082,413,539,5,28,340,119,128,107.5630252,Here are some of the best Data Science project ideas on regression analysis that you should try as a beginner in data science.,#datascience #datasciencejobs #datasciencetraining #datascienceeducation #datasciencecourse #data #dataanalysis #dataanalytics #datascientist #machinelearning #artificialintelligence #ai #deeplearning #machinelearningprojects #datascienceprojects #amankharwal #thecleverprogrammer
5/5/2022,26085,14625,772,9462,563,295,5,17,314,70,118,168.5714286,A user's IP address is defanged to prevent the user from clicking on a malicious link. Here’s how you can write a Python function to defang and IP Address.,#python #pythonprogramming #pythoncode #pythonlearning #pythondeveloper #pythonprogrammer #pythonprojects #python3 #pythoncoding #pythonprogramminglanguage #amankharwal #thecleverprogrammer
5/6/2022,71489,8513,6132,53816,2441,1200,10,71,692,1285,612,47.62645914,Practice these 95 Data Science Projects For Beginners Solved & Explained using Python. Find all these projects from the link in bio.,#datascience #datasciencejobs #datasciencetraining #datascienceeducation #datasciencecourse #python #pythonprojects #data #dataanalysis #dataanalytics #datascientist #machinelearning #artificialintelligence #ai #deeplearning #machinelearningprojects #datascienceprojects #amankharwal #thecleverprogrammer
5/7/2022,73298,3805,16572,51215,1008,1734,17,125,1059,236,322,136.440678,Here are some of the best Machine Learning Certifications you can choose from in 2022.,#machinelearning #machinelearningalgorithms #datascience #dataanalysis #dataanalytics #datascientist #python #pythonprogramming #pythonprojects #pythoncode #artificialintelligence #ai #deeplearning #algorithm #algorithms #amankharwal #thecleverprogrammer
5/8/2022,35868,2408,13381,19054,407,672,19,36,583,156,96,61.53846154,"Every sporting event today generates data that can be used to analyze the performance of players, teams and every event of the game. So the use of data science in sports analytics is common today. Here are some of the best data science project ideas on sports analytics that you should try in 2022.",#datascience #datasciencejobs #datasciencetraining #datascienceeducation #datasciencecourse #data #dataanalysis #dataanalytics #datascientist #machinelearning #artificialintelligence #ai #deeplearning #machinelearningprojects #datascienceprojects #amankharwal #thecleverprogrammer
5/9/2022,42586,3015,11369,27226,400,870,18,46,662,100,136,136,Here are some of the best resources to learn AWS for Data Science.,#datascience #datasciencejobs #datasciencetraining #datascienceeducation #datasciencecourse #data #dataanalysis #dataanalytics #datascientist #machinelearning #artificialintelligence #ai #deeplearning #machinelearningprojects #datascienceprojects #amankharwal #thecleverprogrammer
5/10/2022,35334,11748,1354,21282,345,475,9,33,475,155,146,94.19354839,The FizzBuzz algorithm is one of the favourite questions in coding interviews. Fizz and Buzz refer to any number that is a multiple of 3 and 5. Here is how to implement the FizzBuzz algorithm using the Python programming language.,#python #pythonprogramming #pythoncode #pythonlearning #pythondeveloper #pythonprogrammer #pythonprojects #python3 #pythoncoding #pythonprogramminglanguage #amankharwal #thecleverprogrammer
5/11/2022,17234,5421,6033,4059,1145,479,14,32,371,614,307,50,30+ Data Analysis Projects solved and explained using Python. Try these data analysis projects to improve your data analysis skills using Python.,#dataanalysis #dataanalytics #dataanalyst #python #datascience #datasciencejobs #datasciencetraining #datascienceeducation #datasciencecourse #data #datascientist #machinelearning #artificialintelligence #ai #deeplearning #machinelearningprojects #datascienceprojects #amankharwal #thecleverprogrammer
5/12/2022,14362,3639,1810,7911,283,230,13,13,298,43,10,23.25581395,Here are some of the most important soft skills that every data scientist should have.,#datascience #datasciencejobs #datasciencetraining #datascienceeducation #datasciencecourse #data #dataanalysis #dataanalytics #datascientist #machinelearning #artificialintelligence #ai #deeplearning #machinelearningprojects #datascienceprojects #amankharwal #thecleverprogrammer
5/13/2022,64568,6570,4046,51907,1322,1730,15,101,887,345,272,78.84057971,Here are some of the best and unique data analysis project ideas for resume that you should try in 2022.,#dataanalysis #dataanalytics #dataanalyst #python #datascience #datasciencejobs #datasciencetraining #datascienceeducation #datasciencecourse #data #datascientist #machinelearning #artificialintelligence #ai #deeplearning #machinelearningprojects #datascienceprojects #amankharwal #thecleverprogrammer
5/14/2022,24969,3896,2734,16966,729,216,9,49,322,321,188,58.56697819,Data Science Project on Virat Kohli Performance Analysis using Python: Link in bio,#datascience #datasciencejobs #datasciencetraining #datascienceeducation #datasciencecourse #data #dataanalysis #dataanalytics #datascientist #machinelearning #artificialintelligence #ai #deeplearning #machinelearningprojects #datascienceprojects #amankharwal #thecleverprogrammer
5/15/2022,17315,7744,1700,6959,278,389,11,27,310,47,32,68.08510638,Here are some of the best resources to learn GCP for Data Science.,#datascience #datasciencejobs #datasciencetraining #datascienceeducation #datasciencecourse #data #dataanalysis #dataanalytics #datascientist #machinelearning #artificialintelligence #ai #deeplearning #machinelearningprojects #datascienceprojects #amankharwal #thecleverprogrammer
5/16/2022,14100,4803,2060,5959,403,374,7,19,338,67,34,50.74626866,Password Authentication is the process of checking the identity of a user. Here is how you can authenticate password of a user using Python.,#python #pythonprogramming #pythoncode #pythonlearning #pythondeveloper #pythonprogrammer #pythonprojects #python3 #pythoncoding #pythonprogramminglanguage #amankharwal #thecleverprogrammer
5/17/2022,137081,13856,5709,104293,12692,2416,20,205,1421,2888,1542,53.3933518,180+ Python Projects with Source Code solved and explained for free: Link in Bio,#python #pythonprogramming #pythoncode #pythonlearning #pythondeveloper #pythonprogrammer #pythonprojects #python3 #pythoncoding #pythonprogramminglanguage #amankharwal #thecleverprogrammer
5/18/2022,36232,8053,3488,23136,606,728,9,48,494,134,44,32.8358209,Here are some of the best data science courses that you can choose from in 2022 to learn everything in data science.,#datascience #datasciencejobs #datasciencetraining #datascienceeducation #datasciencecourse #data #dataanalysis #dataanalytics #datascientist #machinelearning #artificialintelligence #ai #deeplearning #machinelearningprojects #datascienceprojects #amankharwal #thecleverprogrammer
5/19/2022,79547,18051,5885,52918,1956,1686,14,99,1176,231,264,114.2857143,Here are some of the best machine learning project ideas every beginner should try.,#machinelearning #machinelearningalgorithms #datascience #dataanalysis #dataanalytics #datascientist #python #pythonprogramming #pythonprojects #pythoncode #artificialintelligence #ai #deeplearning #algorithm #algorithms #amankharwal #thecleverprogrammer
5/20/2022,22117,3958,3207,13960,349,317,10,12,290,46,14,30.43478261,Here are some of the best resources to learn TensorFlow for Machine Learning that you can follow in 2022.,#machinelearning #machinelearningalgorithms #datascience #dataanalysis #dataanalytics #datascientist #python #pythonprogramming #pythonprojects #pythoncode #artificialintelligence #ai #deeplearning #algorithm #algorithms #amankharwal #thecleverprogrammer
5/21/2022,18550,3811,4544,9123,425,155,11,7,272,109,34,31.19266055,"If you want to learn how to use our Instagram data for the task of Instagram reach analysis, this is for you. Here, I will take you through a Data Science Project on Instagram Reach Analysis and prediction with machine learning using Python.",#datascience #datasciencejobs #datasciencetraining #datascienceeducation #datasciencecourse #data #dataanalysis #dataanalytics #datascientist #machinelearning #artificialintelligence #ai #deeplearning #machinelearningprojects #datascienceprojects #amankharwal #thecleverprogrammer
5/22/2022,185504,11956,5551,164833,2559,2935,28,175,2091,759,895,117.9183136,Here’s how to create an age calculator using Python.,#python #pythonprogramming #pythoncode #pythonlearning #pythondeveloper #pythonprogrammer #pythonprojects #python3 #pythoncoding #pythonprogramminglanguage #amankharwal #thecleverprogrammer
5/23/2022,104208,5496,11338,84489,2223,641,8,36,792,876,398,45.43378995,Here is a list of all data visualizations you need for data science explained using Python.,#datascience #datasciencejobs #datasciencetraining #datascienceeducation #datasciencecourse #data #dataanalysis #dataanalytics #datascientist #machinelearning #artificialintelligence #ai #deeplearning #machinelearningprojects #datascienceprojects #amankharwal #thecleverprogrammer
5/24/2022,81589,11981,5114,62820,902,1795,12,140,1059,306,182,59.47712418,Here are some of the best Python courses you can choose from in 2022 to learn Python.,#python #pythonprogramming #pythoncode #pythonlearning #pythondeveloper #pythonprogrammer #pythonprojects #python3 #pythoncoding #pythonprogramminglanguage #amankharwal #thecleverprogrammer
5/25/2022,64362,6423,5695,50960,600,895,12,61,744,189,130,68.78306878,Here are some of the best data science project ideas on Sentiment Analysis that you should try in 2022.,#datascience #datasciencejobs #datasciencetraining #datascienceeducation #datasciencecourse #data #dataanalysis #dataanalytics #datascientist #machinelearning #artificialintelligence #ai #deeplearning #machinelearningprojects #datascienceprojects #amankharwal #thecleverprogrammer
5/26/2022,28918,4233,3075,20747,260,176,5,12,257,219,88,40.1826484,"To check whether Tinder helps people find partners, we can analyze the sentiments of people about Tinder. Here you will learn how to perform Tinder Reviews Sentiment Analysis using Python. Find this data science project from the link in bio.",#datascience #datasciencejobs #datasciencetraining#datascienceeducation #datasciencecourse #data #dataanalysis#dataanalytics #datascientist #machinelearning#artificialintelligence #ai #deeplearning#machinelearningprojects #datascienceprojects #amankharwal#thecleverprogrammer
5/27/2022,28262,6292,1007,19943,383,554,10,36,507,88,78,88.63636364,Here are some of the most important tools that every Python programmer should know.,#python #pythonprogramming #pythoncode #pythonlearning#pythondeveloper #pythonprogrammer #pythonprojects#python3 #pythoncoding #pythonprogramminglanguage#amankharwal #thecleverprogrammer
5/28/2022,40531,3357,3301,32414,1023,215,8,12,315,230,126,54.7826087,Learn how to train a language detection model with machine learning using the Python programming language.,#machinelearning #machinelearningalgorithms #datascience#dataanalysis #dataanalytics #datascientist #python#pythonprogramming #pythonprojects #pythoncode#artificialintelligence #ai #deeplearning #algorithm #algorithms#amankharwal #thecleverprogrammer
5/29/2022,55419,6166,1070,47106,580,540,11,28,489,156,104,66.66666667,"Grouping anagrams is one of the popular questions in coding interviews. Here you will be given a list of words, and you have to write an algorithm to group all the words which are anagrams of each other. Here's how to group anagrams using Python.",#python #pythonprogramming #pythoncode #pythonlearning#pythondeveloper #pythonprogrammer #pythonprojects#python3 #pythoncoding #pythonprogramminglanguage#amankharwal #thecleverprogrammer
5/30/2022,226323,6698,7341,208595,3419,1554,18,94,1380,1982,1236,62.36125126,Here is a list of 100+ Machine Learning Algorithms and Models explained using Python that will help you to understand the implementation of all the machine learning algorithms and models in solving real-time business problems. You can find this list of 100+ Machine Learning Algorithms and Models from the link in bio.,#machinelearning #machinelearningalgorithms #datascience #dataanalysis #dataanalytics #datascientist #python #pythonprogramming #pythonprojects #pythoncode #artificialintelligence #ai #deeplearning #algorithm #algorithms #amankharwal #thecleverprogrammer
5/31/2022,104614,10348,3511,89399,870,2068,13,148,1013,246,316,128.4552846,"A data science project report is a document used to report and explain your approach to solving the problem and explain your analysis and findings. If you are a Data Science student, you have to prepare the report on your project according to the format provided by your university. And as a Data Science professional, you have to create the project report according to the industry standards. Thus, the format of the report and the way of presenting it may be different in universities and companies, but the content should revolve around your approach, your analysis and your findings. So here is how you can create a Data Science project report step by step.",#datascience #datasciencejobs #datasciencetraining #datascienceeducation #datasciencecourse #data #dataanalysis #dataanalytics #datascientist #machinelearning #artificialintelligence #ai #deeplearning #machinelearningprojects #datascienceprojects #amankharwal #thecleverprogrammer
6/1/2022,33006,4755,1544,25979,260,641,11,33,456,129,100,77.51937984,Here are some of the best Data Science project ideas on Healthcare and Fitness that you should try.,#datascience #datasciencejobs #datasciencetraining #datascienceeducation #datasciencecourse #data #dataanalysis #dataanalytics #datascientist #machinelearning #artificialintelligence #ai #deeplearning #machinelearningprojects #datascienceprojects #amankharwal #thecleverprogrammer
6/2/2022,79196,7120,1206,66888,720,456,0,27,491,418,204,48.80382775,"Analyzing the data collected on your fitness is one of the use cases of Data Science in healthcare. So if you want to learn how to analyze smartwatch fitness data, this is for you. Here you will learn how to perform Smartwatch Data Analysis using Python.",#datascience #datasciencejobs #datasciencetraining #datascienceeducation #datasciencecourse #data #dataanalysis #dataanalytics #datascientist #machinelearning #artificialintelligence #ai #deeplearning #machinelearningprojects #datascienceprojects #amankharwal #thecleverprogrammer
6/3/2022,12213,4926,1384,5557,112,197,8,14,345,18,6,33.33333333,Here are some of the best Code Editors and IDE for Python Developers.,#python #pythonprogramming #pythoncode #pythonlearning#pythondeveloper #pythonprogrammer #pythonprojects#python3 #pythoncoding #pythonprogramminglanguage#amankharwal #thecleverprogrammer
