Date,Impressions,From Home,From Hashtags,From Explore,From Other,Saves,Comments,Shares,Likes,Profile Visits,Follows,Conversion Rate,Caption,Hashtags
3/15/2022,5394,2275,2975,45,65,61,19,6,147,69,6,8.695652174,"You must have heard or invested in any cryptocurrency once in your life. It is a digital medium of exchange that is encrypted and decentralized. If you want to know how to predict the future prices of any cryptocurrency with machine learning, this will help you. Here you will learn how to predict the future prices of bitcoin with machine learning using Python.",#data #datascience #dataanalysis #dataanalytics #datascientist #machinelearning #python #pythonprogramming #pythonprojects #pythoncode #artificialintelligence #ai #deeplearning #machinelearningprojects #datascienceprojects #amankharwal #thecleverprogrammer #bitcoin #cryptocurrency
3/16/2022,2766,2541,116,51,9,40,10,4,114,11,6,54.54545455,Here are all the programming languages that Facebook uses in the Front-end and the back-end of Facebook.,#programming #coding #programmer #python #developer #javascript #technology #code #coder #java #html #computerscience #tech #css #webdeveloper #software #webdevelopment #codinglife #softwaredeveloper #linux #programmingmemes #webdesign #programmers #php #programminglife #machinelearning #hacking #pythonprogramming #thecleverprogrammer #amankharwal
3/17/2022,3924,2244,1278,326,34,139,11,3,151,19,2,10.52631579,Here are some of the most popular data science case studies and projects that every data science beginner should try. You can find these case studies and projects with solutions at Kaggle.,#data #datascience #dataanalysis #dataanalytics #datascientist #machinelearning #python #pythonprogramming #pythonprojects #pythoncode #artificialintelligence #ai #deeplearning #algorithm #algorithms #machinelearningalgorithms #ml #amankharwal #thecleverprogrammer #projects #casestudies
3/18/2022,3015,2034,771,115,41,52,11,4,92,9,2,22.22222222,Here’s how Amazon uses your data as an e-commerce platform. I hope this post will help you to understand how Amazon is using data science to improve the quality of its services.,#data #datascience #dataanalysis #dataanalytics #datascientist #machinelearning #python #pythonprogramming #pythonprojects #pythoncode #artificialintelligence #ai #deeplearning #machinelearningprojects #datascienceprojects #amankharwal #thecleverprogrammer #machinelearningmodels #zomato #business #casestudy #businessmodel #amazonfinds
3/19/2022,5409,2643,2006,1068,230,393,10,27,275,38,14,36.84210526,"Here is a complete roadmap to data science that you can follow to learn data science from scratch. All the resources to learn from are also mentioned here. Swipe>>, Save, and Share.",#data #datascience #dataanalysis #dataanalytics #datascientist #machinelearning #python #pythonprogramming #pythonprojects #pythoncode #artificialintelligence #ai #deeplearning #machinelearningprojects #datascienceprojects #amankharwal #thecleverprogrammer #roadmap
3/20/2022,5323,2000,2053,988,74,152,6,13,192,42,8,19.04761905,"If you are looking for some trending and unique topics for working on a data science project, then here are some data science project ideas based on trending and unique topics that you can try.",#data #datascience #dataanalysis #dataanalytics #datascientist #machinelearning #python #pythonprogramming #pythonprojects #pythoncode #artificialintelligence #ai #deeplearning #machinelearningprojects #datascienceprojects #amankharwal #thecleverprogrammer
3/21/2022,8001,2261,5055,300,172,83,8,7,203,92,14,15.2173913,"Many countries are supporting Ukraine by introducing economic sanctions on Russia. There are a lot of tweets about the Ukraine and Russia war where people tend to update about the ground truths, what they feel about it, and who they are supporting. Here you will learn to analyze the sentiments of people over the Ukraine and Russian War. Learn how to perform twitter sentiment analysis on Ukraine and Russia War using Python from the link in bio.",#data #datascience #dataanalysis #dataanalytics #datascientist #machinelearning #python #pythonprogramming #pythonprojects #pythoncode #artificialintelligence #ai #deeplearning #sentimentanalysis #sentiment #nlp #naturallanguageprocessing #amankharwal #thecleverprogrammer #ukraine
3/22/2022,4150,1807,1085,463,792,74,4,2,145,75,28,37.33333333,"Each company has its ways of creating an OTP for verification, but most of the companies have their systems programmed to generate a 6-digit random number. So here you will learn the complete process of OTP verification using Python.",#python #pythonprogramming #pythonprojects #pythoncode #pythonlearning #pythondeveloper #pythoncoding #pythonprogrammer #amankharwal #thecleverprogrammer #pythonprojects #otp #otpverification
3/23/2022,4609,2032,911,857,532,94,1,12,168,21,18,85.71428571,Here are the real world applications of Python in the industry.,#python #pythonprogramming #pythonprojects #pythoncode #pythonlearning #pythondeveloper #pythoncoding #pythonprogrammer #amankharwal #thecleverprogrammer #coding #programming #computerscience #datascience #webdevelopment #machinelearning
3/24/2022,6348,2517,2660,737,154,188,4,15,194,26,12,46.15384615,"If you are a Data Science student, you must have found it hard to choose a topic for creating your first data science project as a beginner. Some universities give a list that you can choose from, while some universities give complete freedom to the students to choose any topic. So how should you choose a topic for a data science project? Here is a complete guide on how to choose a topic for a data science project.",#data #datascience #dataanalysis #dataanalytics #datascientist #machinelearning #python #pythonprogramming #pythonprojects #pythoncode #artificialintelligence #ai #deeplearning #machinelearningprojects #datascienceprojects #amankharwal #thecleverprogrammer
3/25/2022,11068,2099,2986,5634,122,214,7,8,250,39,34,87.17948718,Here are some of the best data science project ideas based on Social Media that you should try in 2022.,#data #datascience #dataanalysis #dataanalytics #datascientist #machinelearning #python #pythonprogramming #pythonprojects #pythoncode #artificialintelligence #ai #deeplearning #machinelearningprojects #datascienceprojects #amankharwal #thecleverprogrammer
3/26/2022,7231,1855,4156,703,309,73,8,3,171,74,26,35.13513514,"I have been researching Instagram reach for a long time now. Every time I post on my Instagram account, I collect data on how well the post reach after a week. That helps in understanding how Instagram's algorithm is working. Here you will learn how to perform Instagram Reach Analysis and predict the reach of your Instagram posts with machine learning using Python.",#data #datascience #dataanalysis #dataanalytics #datascientist #machinelearning #python #pythonprogramming #pythonprojects #pythoncode #artificialintelligence #ai #deeplearning #machinelearningprojects #datascienceprojects #amankharwal #thecleverprogrammer #instagram #instagramreach
3/27/2022,17396,1817,10008,5192,251,285,7,7,416,467,260,55.6745182,Here is a list of 100+ Machine Learning Algorithms and Models explained using Python that will help you to understand the implementation of all the machine learning algorithms and models in solving real-time business problems. You can find this list of 100+ Machine Learning Algorithms and Models from the link in bio.,#machinelearning #machinelearningalgorithms #datascience #dataanalysis #dataanalytics #datascientist #python #pythonprogramming #pythonprojects #pythoncode #artificialintelligence #ai #deeplearning #algorithm #algorithms #amankharwal #thecleverprogrammer
3/28/2022,6814,2816,2769,900,128,469,8,22,249,24,16,66.66666667,Here are some of the best websites that you can follow to learn everything in data science.,#datascience #datasciencejobs #datasciencetraining #datascienceeducation #datasciencecourse #data #dataanalysis #dataanalytics #datascientist #machinelearning #artificialintelligence #ai #deeplearning #machinelearningprojects #datascienceprojects #amankharwal #thecleverprogrammer
3/29/2022,17713,2449,2141,12389,561,504,3,23,308,70,96,137.1428571,Here are some of the best resources to learn SQL for data science.,#sql #mysql #datascience #datasciencejobs #datasciencetraining #datascienceeducation #datasciencecourse #data #dataanalysis #dataanalytics #datascientist #machinelearning #artificialintelligence #ai #deeplearning #machinelearningprojects #datascienceprojects #amankharwal #thecleverprogrammer
3/30/2022,5563,3813,362,1135,76,149,5,8,163,22,20,90.90909091,Here are the best Python libraries for data visualization that you should learn for data science.,#datavisualization #datascience #datasciencejobs #datasciencetraining #datascienceeducation #datasciencecourse #data #dataanalysis #dataanalytics #datascientist #machinelearning #artificialintelligence #ai #deeplearning #machinelearningprojects #datascienceprojects #amankharwal #thecleverprogrammer
3/31/2022,4842,1658,694,2036,310,55,6,4,86,46,30,65.2173913,Learn how to create an interactive language translator using the Python programming language.,#python #pythonprogramming #pythoncode #pythonlearning #pythondeveloper #pythonprogrammer #pythonprojects #python3 #pythoncoding #pythonprogramminglanguage #amankharwal #thecleverprogrammer #nlp #naturallanguageprocessing
4/1/2022,11149,4439,747,5762,53,273,4,13,210,61,58,95.08196721,"Python is one of the best programming languages for numerical calculations. So you should know how to calculate mean, median and mode using Python without using any built-in Python library or module. Here’s how to calculate mean, median, and mode using Python.",#python #pythonprogramming #pythoncode #pythonlearning #pythondeveloper #pythonprogrammer #pythonprojects #python3 #pythoncoding #pythonprogramminglanguage #amankharwal #thecleverprogrammer
4/2/2022,10206,2371,1624,6000,117,182,10,17,172,237,100,42.19409283,Practice these 90+ Data Science Projects For Beginners Solved & Explained using Python. Find all these projects from the link in bio.,#datascience #datasciencejobs #datasciencetraining #datascienceeducation #datasciencecourse #data #dataanalysis #dataanalytics #datascientist #machinelearning #artificialintelligence #ai #deeplearning #machinelearningprojects #datascienceprojects #amankharwal #thecleverprogrammer
4/3/2022,13700,5185,3041,5352,77,573,2,38,373,73,80,109.5890411,Here are some of the best data science certifications that you can choose from in 2022.,#datascience #datasciencejobs #datasciencetraining #datascienceeducation #datasciencecourse #data #dataanalysis #dataanalytics #datascientist #machinelearning #artificialintelligence #ai #deeplearning #machinelearningprojects #datascienceprojects #amankharwal #thecleverprogrammer
4/4/2022,5731,1923,1368,2266,65,135,4,1,148,20,18,90,"Clustering is a machine learning technique used to classify data points, charaterized by some specific features into groups. It is an unsupervised machine learning method where the data we deal with is not labelled. Here are some of the best Machine Learning project ideas on Clustering that you should try.",#machinelearning #machinelearningalgorithms #datascience #dataanalysis #dataanalytics #datascientist #python #pythonprogramming #pythonprojects #pythoncode #artificialintelligence #ai #deeplearning #algorithm #algorithms #amankharwal #thecleverprogrammer #clustering
4/5/2022,4139,1133,1538,1367,33,36,0,1,92,34,10,29.41176471,Clustering music genres is a task of grouping music based on the similarities in their audio characteristics. Here you will learn how to do clustering analysis of music genres with Machine Learning using Python.,#machinelearning #machinelearningalgorithms #datascience #dataanalysis #dataanalytics #datascientist #python #pythonprogramming #pythonprojects #pythoncode #artificialintelligence #ai #deeplearning #algorithm #algorithms #amankharwal #thecleverprogrammer #clustering
4/6/2022,32695,11815,3147,17414,170,1095,2,75,549,148,214,144.5945946,Here are some of the best data science certifications that you can choose from in 2022.,#datascience #datasciencejobs #datasciencetraining #datascienceeducation #datasciencecourse #data #dataanalysis #dataanalytics #datascientist #machinelearning #artificialintelligence #ai #deeplearning #machinelearningprojects #datascienceprojects #amankharwal #thecleverprogrammer
4/7/2022,36919,13473,4176,16444,2547,653,5,26,443,611,228,37.31587561,175 Python Projects with Source Code solved and explained for free: Link in Bio,#python #pythonprogramming #pythonprojects #pythoncode #pythonlearning #pythondeveloper #pythoncoding #pythonprogrammer #amankharwal #thecleverprogrammer #pythonprojects
4/8/2022,6869,2514,2669,794,268,212,4,15,201,31,12,38.70967742,"If you are a Data Science student, you must have found it hard to choose a topic for creating your first data science project as a beginner. Some universities give a list that you can choose from, while some universities give complete freedom to the students to choose any topic. So how should you choose a topic for a data science project? Here is a complete guide on how to choose a topic for a data science project.",#data #datascience #dataanalysis #dataanalytics #datascientist #machinelearning #python #pythonprogramming #pythonprojects #pythoncode #artificialintelligence #ai #deeplearning #machinelearningprojects #datascienceprojects #amankharwal #thecleverprogrammer
4/9/2022,11561,2099,2994,5726,187,237,7,9,258,46,40,86.95652174,Here are some of the best data science project ideas based on Social Media that you should try in 2022.,#data #datascience #dataanalysis #dataanalytics #datascientist #machinelearning #python #pythonprogramming #pythonprojects #pythoncode #artificialintelligence #ai #deeplearning #machinelearningprojects #datascienceprojects #amankharwal #thecleverprogrammer
4/10/2022,7736,1856,4211,721,423,82,12,8,175,88,36,40.90909091,"I have been researching Instagram reach for a long time now. Every time I post on my Instagram account, I collect data on how well the post reach after a week. That helps in understanding how Instagram's algorithm is working. Here you will learn how to perform Instagram Reach Analysis and predict the reach of your Instagram posts with machine learning using Python.",#data #datascience #dataanalysis #dataanalytics #datascientist #machinelearning #python #pythonprogramming #pythonprojects #pythoncode #artificialintelligence #ai #deeplearning #machinelearningprojects #datascienceprojects #amankharwal #thecleverprogrammer #instagram #instagramreach
4/11/2022,18629,1820,10080,5618,485,318,7,14,433,533,308,57.78611632,Here is a list of 100+ Machine Learning Algorithms and Models explained using Python that will help you to understand the implementation of all the machine learning algorithms and models in solving real-time business problems. You can find this list of 100+ Machine Learning Algorithms and Models from the link in bio.,#machinelearning #machinelearningalgorithms #datascience #dataanalysis #dataanalytics #datascientist #python #pythonprogramming #pythonprojects #pythoncode #artificialintelligence #ai #deeplearning #algorithm #algorithms #amankharwal #thecleverprogrammer
4/12/2022,7698,2818,2797,1038,297,560,8,33,274,34,26,76.47058824,Here are some of the best websites that you can follow to learn everything in data science.,#datascience #datasciencejobs #datasciencetraining #datascienceeducation #datasciencecourse #data #dataanalysis #dataanalytics #datascientist #machinelearning #artificialintelligence #ai #deeplearning #machinelearningprojects #datascienceprojects #amankharwal #thecleverprogrammer
4/13/2022,20449,2449,2178,13774,1357,618,4,26,349,109,148,135.7798165,Here are some of the best resources to learn SQL for data science.,#sql #mysql #datascience #datasciencejobs #datasciencetraining #datascienceeducation #datasciencecourse #data #dataanalysis #dataanalytics #datascientist #machinelearning #artificialintelligence #ai #deeplearning #machinelearningprojects #datascienceprojects #amankharwal #thecleverprogrammer
4/14/2022,6803,3819,739,1604,257,211,5,9,200,38,40,105.2631579,Here are the best Python libraries for data visualization that you should learn for data science.,#datavisualization #datascience #datasciencejobs #datasciencetraining #datascienceeducation #datasciencecourse #data #dataanalysis #dataanalytics #datascientist #machinelearning #artificialintelligence #ai #deeplearning #machinelearningprojects #datascienceprojects #amankharwal #thecleverprogrammer
4/15/2022,16946,4562,816,10633,186,387,4,23,264,100,116,116,"Python is one of the best programming languages for numerical calculations. So you should know how to calculate mean, median and mode using Python without using any built-in Python library or module. Here’s how to calculate mean, median, and mode using Python.",#python #pythonprogramming #pythoncode #pythonlearning #pythondeveloper #pythonprogrammer #pythonprojects #python3 #pythoncoding #pythonprogramminglanguage #amankharwal #thecleverprogrammer
4/16/2022,34072,2561,1793,28231,607,463,10,44,277,650,398,61.23076923,Practice these 90+ Data Science Projects For Beginners Solved & Explained using Python. Find all these projects from the link in bio.,#datascience #datasciencejobs #datasciencetraining #datascienceeducation #datasciencecourse #data #dataanalysis #dataanalytics #datascientist #machinelearning #artificialintelligence #ai #deeplearning #machinelearningprojects #datascienceprojects #amankharwal #thecleverprogrammer
4/17/2022,42417,11925,3291,25425,801,1659,5,129,728,259,366,141.3127413,Here are some of the best data science certifications that you can choose from in 2022.,#datascience #datasciencejobs #datasciencetraining #datascienceeducation #datasciencecourse #data #dataanalysis #dataanalytics #datascientist #machinelearning #artificialintelligence #ai #deeplearning #machinelearningprojects #datascienceprojects #amankharwal #thecleverprogrammer
4/18/2022,18179,4773,1496,10626,295,771,0,52,373,90,130,144.4444444,Here are some of the most important Python libraries that every Python developer should know.,#python #pythonprogramming #pythoncode #pythonlearning #pythondeveloper #pythonprogrammer #pythonprojects #python3 #pythoncoding #pythonprogramminglanguage #amankharwal #thecleverprogrammer
4/19/2022,20133,5443,1715,11214,552,362,8,13,285,105,134,127.6190476,"When the value of variable increases or decreases with the increase or decrease in the value of another variable, then it is nothing but a linear relationship. Here’s how to visualize a linear relationship using the Python programming language.",#python #pythonprogramming #pythoncode #pythonlearning #pythondeveloper #pythonprogrammer #pythonprojects #python3 #pythoncoding #pythonprogramminglanguage #amankharwal #thecleverprogrammer
4/20/2022,145902,2706,3245,136389,2718,1972,16,149,955,2544,1797,70.63679245,30 Data Analysis Projects solved and explained using Python. Try these data analysis projects to improve your data analysis skills using Python.,#dataanalysis #dataanalytics #dataanalyst #python #datascience #datasciencejobs #datasciencetraining #datascienceeducation #datasciencecourse #data #datascientist #machinelearning #artificialintelligence #ai #deeplearning #machinelearningprojects #datascienceprojects #amankharwal #thecleverprogrammer
4/21/2022,18226,6542,1457,8687,173,319,12,30,272,50,38,76,"People who are starting to learn data science have either an engineering background, a statistical background, or a non-computer background. Each person has their own set of skills and knowledge, so here is how you should choose a data science job for yourself according to your skills and educational background.",#datascience #datasciencejobs #datasciencetraining #datascienceeducation #datasciencecourse #data #dataanalysis #dataanalytics #datascientist #machinelearning #artificialintelligence #ai #deeplearning #machinelearningprojects #datascienceprojects #amankharwal #thecleverprogrammer
4/22/2022,29121,11574,1537,14343,431,811,4,59,486,207,245,118.3574879,Here are some of the best data science project ideas on Finance that you should try in 2022.,#datascience #datasciencejobs #datasciencetraining #datascienceeducation #datasciencecourse #data #dataanalysis #dataanalytics #datascientist #machinelearning #artificialintelligence #ai #deeplearning #machinelearningprojects #datascienceprojects #amankharwal #thecleverprogrammer
4/23/2022,107722,7615,1957,94794,2064,4541,20,332,1623,633,866,136.8088468,Here are some of the best Python certifications that you can choose from in 2022.,#python #pythonprogramming #pythoncode #pythonlearning #pythondeveloper #pythonprogrammer #pythonprojects #python3 #pythoncoding #pythonprogramminglanguage #amankharwal #thecleverprogrammer
4/24/2022,27750,3850,2366,19616,733,263,6,9,308,253,144,56.91699605,Learn how to perform the task of OTP Verification using Python.,#python #pythonprogramming #pythoncode #pythonlearning #pythondeveloper #pythonprogrammer #pythonprojects #python3 #pythoncoding #pythonprogramminglanguage #amankharwal #thecleverprogrammer
4/25/2022,25553,5354,1374,17312,597,345,3,12,275,81,82,101.2345679,Here’s how to calculate execution time of a Python program.,#python #pythonprogramming #pythoncode #pythonlearning #pythondeveloper #pythonprogrammer #pythonprojects #python3 #pythoncoding #pythonprogramminglanguage #amankharwal #thecleverprogrammer
4/26/2022,207157,7581,4217,191478,3114,4217,15,472,1798,5121,3022,59.01191174,178 Python Projects with Source Code solved and explained for free: Link in Bio,#python #pythonprogramming #pythoncode #pythonlearning #pythondeveloper #pythonprogrammer #pythonprojects #python3 #pythoncoding #pythonprogramminglanguage #amankharwal #thecleverprogrammer
4/27/2022,12100,3981,2380,3926,496,473,11,25,372,81,60,74.07407407,Here are some of the best Data Analysis certifications that you can choose from in 2022.,#dataanalysis #dataanalytics #dataanalyst #python #datascience #datasciencejobs #datasciencetraining #datascienceeducation #datasciencecourse #data #datascientist #machinelearning #artificialintelligence #ai #deeplearning #machinelearningprojects #datascienceprojects #amankharwal #thecleverprogrammer
4/28/2022,31438,6139,21819,1890,617,559,10,43,396,133,112,84.21052632,"Here are some of the best data science project ideas on the Economy. If you want to learn the use of Data Science in Economics, you should try these data science projects.",#datascience #datasciencejobs #datasciencetraining #datascienceeducation #datasciencecourse #data #dataanalysis #dataanalytics #datascientist #machinelearning #artificialintelligence #ai #deeplearning #machinelearningprojects #datascienceprojects #amankharwal #thecleverprogrammer
4/29/2022,6919,4046,800,1604,170,274,5,16,208,39,8,20.51282051,Here are some of the best resources to learn Tableau for Data Science.,#datascience #datasciencejobs #datasciencetraining #datascienceeducation #datasciencecourse #data #dataanalysis #dataanalytics #datascientist #tableau #machinelearning #artificialintelligence #ai #deeplearning #machinelearningprojects #datascienceprojects #amankharwal #thecleverprogrammer
4/30/2022,16883,3344,1938,10390,438,178,9,5,210,180,54,30,Waiter Tips analysis is one of the popular data science case studies where we need to predict the tips given to a waiter for serving the food in a restaurant. Find this data science case study solved and explained using Python from the link in bio.,#datascience #datasciencejobs #datasciencetraining #datascienceeducation #datasciencecourse #data #dataanalysis #dataanalytics #datascientist #machinelearning #artificialintelligence #ai #deeplearning #machinelearningprojects #datascienceprojects #amankharwal #thecleverprogrammer
5/1/2022,52209,6118,1968,42329,1047,595,18,35,542,284,284,100,Here’s how to write a Python function to reverse a string.,#python #pythonprogramming #pythoncode #pythonlearning #pythondeveloper #pythonprogrammer #pythonprojects #python3 #pythoncoding #pythonprogramminglanguage #amankharwal #thecleverprogrammer
5/2/2022,61287,3262,6001,50700,636,565,3,20,470,775,408,52.64516129,Here is a list of 100+ Machine Learning Algorithms and Models explained using Python that will help you to understand the implementation of all the machine learning algorithms and models in solving real-time business problems. You can find this list of 100+ Machine Learning Algorithms and Models from the link in bio.,#machinelearning #machinelearningalgorithms #datascience #dataanalysis #dataanalytics #datascientist #python #pythonprogramming #pythonprojects #pythoncode #artificialintelligence #ai #deeplearning #algorithm #algorithms #amankharwal #thecleverprogrammer
